[
  {
    "id": "FED_2020-03-15",
    "bank": "FED",
    "country": "US",
    "meeting_date": "2020-03-15",
    "decision": "cut",
    "rate_before": null,
    "rate_after": 0.25,
    "change_bps": null,
    "target_rate_name": "federal funds target (upper)",
    "statement_url": "https://www.federalreserve.gov/newsevents/pressreleases/monetary20200315a.htm",
    "cited_indicators": {},
    "provenance": {
      "source_url": "https://www.federalreserve.gov/newsevents/pressreleases/monetary20200315a.htm",
      "source_name": "Federal Reserve",
      "scraped_at": "2026-06-01T06:15:54+00:00",
      "ingest_method": "scraper",
      "content_hash": "sha256:26498e090bdd96d5efceb896add66ad43c31ae752e8a87192cc420e55748a052",
      "parser": "fed.py",
      "parser_version": "0.1.0"
    }
  },
  {
    "id": "FED_2020-04-29",
    "bank": "FED",
    "country": "US",
    "meeting_date": "2020-04-29",
    "decision": "hold",
    "rate_before": null,
    "rate_after": 0.25,
    "change_bps": 0,
    "target_rate_name": "federal funds target (upper)",
    "statement_url": "https://www.federalreserve.gov/newsevents/pressreleases/monetary20200429a.htm",
    "cited_indicators": {},
    "provenance": {
      "source_url": "https://www.federalreserve.gov/newsevents/pressreleases/monetary20200429a.htm",
      "source_name": "Federal Reserve",
      "scraped_at": "2026-06-01T06:15:54+00:00",
      "ingest_method": "scraper",
      "content_hash": "sha256:6a4fca1eec53cd5067f38145bc2aa60b9949a96f552e6bbb80eb01e5d2d2d626",
      "parser": "fed.py",
      "parser_version": "0.1.0"
    }
  },
  {
    "id": "FED_2020-06-10",
    "bank": "FED",
    "country": "US",
    "meeting_date": "2020-06-10",
    "decision": "hold",
    "rate_before": null,
    "rate_after": 0.25,
    "change_bps": 0,
    "target_rate_name": "federal funds target (upper)",
    "statement_url": "https://www.federalreserve.gov/newsevents/pressreleases/monetary20200610a.htm",
    "cited_indicators": {},
    "provenance": {
      "source_url": "https://www.federalreserve.gov/newsevents/pressreleases/monetary20200610a.htm",
      "source_name": "Federal Reserve",
      "scraped_at": "2026-06-01T06:15:54+00:00",
      "ingest_method": "scraper",
      "content_hash": "sha256:c5c0d452caa6ea922f49bf6be3c8a3d24282e2adcd990ca0857ae1ae06324865",
      "parser": "fed.py",
      "parser_version": "0.1.0"
    }
  },
  {
    "id": "FED_2020-07-29",
    "bank": "FED",
    "country": "US",
    "meeting_date": "2020-07-29",
    "decision": "hold",
    "rate_before": null,
    "rate_after": 0.25,
    "change_bps": 0,
    "target_rate_name": "federal funds target (upper)",
    "statement_url": "https://www.federalreserve.gov/newsevents/pressreleases/monetary20200729a.htm",
    "cited_indicators": {},
    "provenance": {
      "source_url": "https://www.federalreserve.gov/newsevents/pressreleases/monetary20200729a.htm",
      "source_name": "Federal Reserve",
      "scraped_at": "2026-06-01T06:15:54+00:00",
      "ingest_method": "scraper",
      "content_hash": "sha256:957f5d132b4c63ef8f4cc5e8168d44d05a7e4a9bbd4cb6e2fa302eeca21bbe0a",
      "parser": "fed.py",
      "parser_version": "0.1.0"
    }
  },
  {
    "id": "FED_2020-09-16",
    "bank": "FED",
    "country": "US",
    "meeting_date": "2020-09-16",
    "decision": "hold",
    "rate_before": null,
    "rate_after": 0.25,
    "change_bps": 0,
    "target_rate_name": "federal funds target (upper)",
    "statement_url": "https://www.federalreserve.gov/newsevents/pressreleases/monetary20200916a.htm",
    "cited_indicators": {},
    "provenance": {
      "source_url": "https://www.federalreserve.gov/newsevents/pressreleases/monetary20200916a.htm",
      "source_name": "Federal Reserve",
      "scraped_at": "2026-06-01T06:15:54+00:00",
      "ingest_method": "scraper",
      "content_hash": "sha256:e2b64ded9f42a506ea05a91975a2cda878155e42c3313a190ad043cb1d6d760f",
      "parser": "fed.py",
      "parser_version": "0.1.0"
    }
  },
  {
    "id": "FED_2020-11-05",
    "bank": "FED",
    "country": "US",
    "meeting_date": "2020-11-05",
    "decision": "hold",
    "rate_before": null,
    "rate_after": 0.25,
    "change_bps": 0,
    "target_rate_name": "federal funds target (upper)",
    "statement_url": "https://www.federalreserve.gov/newsevents/pressreleases/monetary20201105a.htm",
    "cited_indicators": {},
    "provenance": {
      "source_url": "https://www.federalreserve.gov/newsevents/pressreleases/monetary20201105a.htm",
      "source_name": "Federal Reserve",
      "scraped_at": "2026-06-01T06:15:54+00:00",
      "ingest_method": "scraper",
      "content_hash": "sha256:b6a2b0389d6effbad696bdc02035b8ce760ce1b1a0504d3d3b839a89a4a2fa43",
      "parser": "fed.py",
      "parser_version": "0.1.0"
    }
  },
  {
    "id": "FED_2020-12-16",
    "bank": "FED",
    "country": "US",
    "meeting_date": "2020-12-16",
    "decision": "hold",
    "rate_before": null,
    "rate_after": 0.25,
    "change_bps": 0,
    "target_rate_name": "federal funds target (upper)",
    "statement_url": "https://www.federalreserve.gov/newsevents/pressreleases/monetary20201216a.htm",
    "cited_indicators": {},
    "provenance": {
      "source_url": "https://www.federalreserve.gov/newsevents/pressreleases/monetary20201216a.htm",
      "source_name": "Federal Reserve",
      "scraped_at": "2026-06-01T06:15:54+00:00",
      "ingest_method": "scraper",
      "content_hash": "sha256:7754d69335b89fe81590fb38617a7bc1227fa98dee798710ba00375a282c936f",
      "parser": "fed.py",
      "parser_version": "0.1.0"
    }
  },
  {
    "id": "FED_2021-01-27",
    "bank": "FED",
    "country": "US",
    "meeting_date": "2021-01-27",
    "decision": "hold",
    "rate_before": null,
    "rate_after": 0.25,
    "change_bps": 0,
    "target_rate_name": "federal funds target (upper)",
    "statement_url": "https://www.federalreserve.gov/newsevents/pressreleases/monetary20210127a.htm",
    "cited_indicators": {},
    "provenance": {
      "source_url": "https://www.federalreserve.gov/newsevents/pressreleases/monetary20210127a.htm",
      "source_name": "Federal Reserve",
      "scraped_at": "2026-06-01T06:15:55+00:00",
      "ingest_method": "scraper",
      "content_hash": "sha256:eaa7eb364006fcb4d0197538c09e585cadc5e19250eb89b9f3b74a39a03dc836",
      "parser": "fed.py",
      "parser_version": "0.1.0"
    }
  },
  {
    "id": "FED_2021-03-17",
    "bank": "FED",
    "country": "US",
    "meeting_date": "2021-03-17",
    "decision": "hold",
    "rate_before": null,
    "rate_after": 0.25,
    "change_bps": 0,
    "target_rate_name": "federal funds target (upper)",
    "statement_url": "https://www.federalreserve.gov/newsevents/pressreleases/monetary20210317a.htm",
    "cited_indicators": {},
    "provenance": {
      "source_url": "https://www.federalreserve.gov/newsevents/pressreleases/monetary20210317a.htm",
      "source_name": "Federal Reserve",
      "scraped_at": "2026-06-01T06:15:55+00:00",
      "ingest_method": "scraper",
      "content_hash": "sha256:41c564e93a237d3b0d215681031b4f17f5f22c2fae9a598eabc3c3989cb757e5",
      "parser": "fed.py",
      "parser_version": "0.1.0"
    }
  },
  {
    "id": "FED_2021-04-28",
    "bank": "FED",
    "country": "US",
    "meeting_date": "2021-04-28",
    "decision": "hold",
    "rate_before": null,
    "rate_after": 0.25,
    "change_bps": 0,
    "target_rate_name": "federal funds target (upper)",
    "statement_url": "https://www.federalreserve.gov/newsevents/pressreleases/monetary20210428a.htm",
    "cited_indicators": {},
    "provenance": {
      "source_url": "https://www.federalreserve.gov/newsevents/pressreleases/monetary20210428a.htm",
      "source_name": "Federal Reserve",
      "scraped_at": "2026-06-01T06:15:55+00:00",
      "ingest_method": "scraper",
      "content_hash": "sha256:bdddc96e708e0cf6528eb6f529da57d006537a1a50eb8d011aef0df8aba5dad7",
      "parser": "fed.py",
      "parser_version": "0.1.0"
    }
  },
  {
    "id": "FED_2021-06-16",
    "bank": "FED",
    "country": "US",
    "meeting_date": "2021-06-16",
    "decision": "hold",
    "rate_before": null,
    "rate_after": 0.25,
    "change_bps": 0,
    "target_rate_name": "federal funds target (upper)",
    "statement_url": "https://www.federalreserve.gov/newsevents/pressreleases/monetary20210616a.htm",
    "cited_indicators": {},
    "provenance": {
      "source_url": "https://www.federalreserve.gov/newsevents/pressreleases/monetary20210616a.htm",
      "source_name": "Federal Reserve",
      "scraped_at": "2026-06-01T06:15:55+00:00",
      "ingest_method": "scraper",
      "content_hash": "sha256:bfd21d080e2aa614c3e566ee6d583695f869406f867bd2f3b4908309a4e3644e",
      "parser": "fed.py",
      "parser_version": "0.1.0"
    }
  },
  {
    "id": "FED_2021-07-28",
    "bank": "FED",
    "country": "US",
    "meeting_date": "2021-07-28",
    "decision": "hold",
    "rate_before": null,
    "rate_after": 0.25,
    "change_bps": 0,
    "target_rate_name": "federal funds target (upper)",
    "statement_url": "https://www.federalreserve.gov/newsevents/pressreleases/monetary20210728a.htm",
    "cited_indicators": {},
    "provenance": {
      "source_url": "https://www.federalreserve.gov/newsevents/pressreleases/monetary20210728a.htm",
      "source_name": "Federal Reserve",
      "scraped_at": "2026-06-01T06:15:55+00:00",
      "ingest_method": "scraper",
      "content_hash": "sha256:ed96c53d8ade9e936185c4ccc85a402ee85cfc51f50b0346121c9e6e0f5f8f9b",
      "parser": "fed.py",
      "parser_version": "0.1.0"
    }
  },
  {
    "id": "FED_2021-09-22",
    "bank": "FED",
    "country": "US",
    "meeting_date": "2021-09-22",
    "decision": "hold",
    "rate_before": null,
    "rate_after": 0.25,
    "change_bps": 0,
    "target_rate_name": "federal funds target (upper)",
    "statement_url": "https://www.federalreserve.gov/newsevents/pressreleases/monetary20210922a.htm",
    "cited_indicators": {},
    "provenance": {